{
  "split_manifest_id": "split_manifest_001",
  "split_schema_version": "split_manifest.v1",
  "dataset_id": "dataset_fraud_demo",
  "source_dataset_version_id": "dataset_version_v1",
  "candidate_dataset_version_id": "dataset_version_v2_candidate",
  "target_column": "is_fraud",
  "strategy": "group_stratified",
  "seed": 42,
  "group_key": "customer_id_hash",
  "policy_version": "split_policy_v0",
  "split_ratios": {
    "train": 0.7,
    "validation": 0.15,
    "test": 0.15
  },
  "assignments": [
    {
      "object_id": "txn_00000",
      "split": "train",
      "label": "0",
      "group_value": "cust_hash_001"
    },
    {
      "object_id": "txn_00001",
      "split": "validation",
      "label": "1",
      "group_value": "cust_hash_002"
    },
    {
      "object_id": "txn_00002",
      "split": "test",
      "label": "0",
      "group_value": "cust_hash_003"
    }
  ],
  "class_distribution": [
    {
      "split": "train",
      "total_count": 140,
      "class_counts": {
        "0": 137,
        "1": 3
      },
      "class_ratios": {
        "0": 0.9785714285714285,
        "1": 0.02142857142857143
      }
    },
    {
      "split": "validation",
      "total_count": 30,
      "class_counts": {
        "0": 29,
        "1": 1
      },
      "class_ratios": {
        "0": 0.9666666666666667,
        "1": 0.03333333333333333
      }
    },
    {
      "split": "test",
      "total_count": 30,
      "class_counts": {
        "0": 29,
        "1": 1
      },
      "class_ratios": {
        "0": 0.9666666666666667,
        "1": 0.03333333333333333
      }
    }
  ],
  "lineage": {
    "action_plan_id": "action_plan_split_001",
    "step_id": "create_split_001",
    "source_dataset_version_id": "dataset_version_v1",
    "candidate_dataset_version_id": "dataset_version_v2_candidate",
    "created_by_job_id": "compute_run_apply_001",
    "config_hash": "sha256:bbbbbbbbbbbbbbbbbbbbbbbbbbbbbbbbbbbbbbbbbbbbbbbbbbbbbbbbbbbbbbbb",
    "source_artifact": {
      "artifact_id": "raw_transactions:aaaaaaaaaaaaaaaa",
      "kind": "raw_transactions",
      "uri": "s3://dataforge-local/dataforge/org_1/project_1/dataset_1/v1/transactions.csv",
      "hash": "sha256:aaaaaaaaaaaaaaaaaaaaaaaaaaaaaaaaaaaaaaaaaaaaaaaaaaaaaaaaaaaaaaaa",
      "media_type": "text/csv",
      "size_bytes": 128,
      "schema_version": "tabular_dataset.v1",
      "lineage": {
        "parent_version_id": "dataset_version_v1",
        "job_id": "compute_run_apply_001",
        "config_hash": "sha256:bbbbbbbbbbbbbbbbbbbbbbbbbbbbbbbbbbbbbbbbbbbbbbbbbbbbbbbbbbbbbbbb",
        "created_at": "2026-05-24T12:00:00Z"
      }
    }
  },
  "generated_at": "2026-05-24T12:00:00Z"
}
